job_title,job_id,city,state,salary,posted_date,job_url,company,education_needed,is_remote,last_scanned_at,description
"Project Controls, Staff",28198,Ashburn,Virginia,NA,NA,https://careers.mcdean.com/jobs/28198?lang=en-us,medstar,High School Diploma or Associate degree or Bachelor's degree,False,2025-08-21 21:38:27,"Project Controls, Staff responsible for aiding, tracking, monitoring status, controlling and performing issue resolution throughout the project's life cycle. Responsible for providing project planning and scheduling documentation to support project and customer requirements, assisting Team Leads, Superintendents and the Project and Program Managers in tracking the projects against baseline schedules and budgets. Also involves assisting Project Manager in maintaining Master schedule for each project, identifying and recording the impact of work performed and not performed as scheduled."
Electrical Apprentice,28222,Ashburn,Virginia,NA,NA,https://careers.mcdean.com/jobs/28222?lang=en-us,medstar,High School diploma or GED required,False,2025-08-21 21:38:38,"M.C. Dean is Building Intelligence®. We design, build, operate, and maintain cyber-physical solutions for the nation’s most recognizable mission critical facilities, secure environments, complex infrastructure, and global enterprises. The company’s capabilities include electrical, electronic security, telecommunications, life safety, automation and controls, audio visual, and IT systems. M.C. Dean is headquartered in Tysons, Virginia, and The M.C. Dean Critical Power department provides our customers with safe and effective maintenance and installation of UPS, battery, and other critical power equipment. This position requires an individual who is keen on learning new applications and capable of critical thinking, customer service, and problem solving as well as working independently after receiving adequate training."
Equipment Operator 1,27369,Dulles,Virginia,NA,NA,https://careers.mcdean.com/jobs/27369?lang=en-us,medstar,High school degree or GED,False,2025-08-21 21:38:48,"M.C. Dean is Building Intelligence®. We design, build, operate, and maintain cyber-physical solutions for the nation’s most recognizable mission critical facilities, secure environments, complex infrastructure, and global enterprises. An Equipment Operator I, operates machines or vehicles equipped with blades/buckets to remove, distribute, level or grade earth, such as a backhoe or excavator. Candidates must demonstrate physical strength and stamina to perform various tasks, including but not limited to, loading, and unloading, operating equipment, and assisting in the transportation of various materials."
Electrical Superintendent,27462,Dulles,Virginia,$10,NA,https://careers.mcdean.com/jobs/27462?lang=en-us,medstar,High School / GED,False,2025-08-21 21:38:56,"M.C. Dean is Building Intelligence®. We design, build, operate, and maintain cyber-physical solutions for the nation’s most recognizable mission critical facilities, secure environments, complex infrastructure, and global enterprises. The company’s capabilities include electrical, electronic security, telecommunications, life safety, automation and controls, audio visual, and IT systems. M.C. Dean is headquartered in Tysons, Virginia, and employs more than 5,800 professionals who engineer and deploy automated, secure, and resilient power and technology systems; and deliver the management platforms essential for long-term system sustainability."
Electrician,28187,Dulles,Virginia,NA,NA,https://careers.mcdean.com/jobs/28187?lang=en-us,medstar,High School diploma or GED,False,2025-08-21 21:39:04,"A Licensed or Non-Licensed Electrician installs basic electrical equipment and systems in accordance with all applicable plans, specifications, codes, and industry standards. Responsibilities include assembling, installing, testing, and maintaining electrical or electronic wiring, conduit, cable, equipment, components and devices associated with electrical equipment, following blueprints of electrical layouts and building plans. In addition, the position involves installing and mounting electronic controls, device, panels, sensors, and components; performing interlock wiring as required; testing electrical systems and continuity of circuits in electrical wiring, equipment, and fixtures, using testing devices."
Electrician,27792,Dulles,Virginia,NA,NA,https://careers.mcdean.com/jobs/27792?lang=en-us,medstar,High School diploma or GED,False,2025-08-21 21:39:21,"M.C. Dean is Building Intelligence®. We design, build, operate, and maintain cyber-physical solutions for the nation’s most recognizable mission critical facilities, secure environments, complex infrastructure, and global enterprises. The company’s capabilities include electrical, electronic security, telecommunications, life safety, automation and controls, audio visual, and IT systems. The company is looking for a Licensed or Non-Licensed Electrician for installing basic electrical equipment and systems in accordance with all applicable plans, specifications, codes, and industry standards."
Electrician,27793,Dulles,Virginia,NA,NA,https://careers.mcdean.com/jobs/27793?lang=en-us,medstar,High School diploma or GED,False,2025-08-21 21:39:32,"M.C. Dean is looking for a Licensed or Non-Licensed Electrician who can install basic electrical equipment and systems in accordance with all applicable plans, specifications, codes, and industry standards. Job responsibilities include assembling, installing, testing, and maintaining electrical or electronic wiring, conduit, cable, equipment, components and devices associated with electrical equipment, following blueprints of electrical layouts and building plans. The Electrician is also expected to perform interlock wiring as required, test electrical systems, inspect installation sites and diagnose malfunctioning systems. This position may require overtime and night and weekend work."
Skilled Laborer,28182,Dulles,Virginia,NA,NA,https://careers.mcdean.com/jobs/28182?lang=en-us,medstar,High School Graduate or General Education Degree (GED); or equivalent studies,False,2025-08-21 21:39:40,"As a skilled laborer, you will assist electricians and other crew members in the installation of electrical systems and components. Duties include working with tools, installing conduit, wire, junction boxes, electrical lighting and other labor activities as assigned. Must keep all materials, tools, and equipment in an orderly fashion, maintain a clean work area at all times, demonstrate safe work habits and exhibit proper care of all tools and equipment."
Electrical Apprentice,28251,Dulles,Virginia,NA,NA,https://careers.mcdean.com/jobs/28251?lang=en-us,medstar,High School diploma or GED,False,2025-08-21 21:39:48,"An Electrician Apprentice assists in the installation of electrical equipment in accordance with all applicable plans, specifications, codes and industry standards. Responsibilities include assembling, installing, testing, and maintaining electrical or electronic wiring, conduit, cable, equipment, components and devices associated with electrical equipment, following blueprints of electrical layouts and building plans."
Technician,28296,Dulles,Virginia,NA,NA,https://careers.mcdean.com/jobs/28296?lang=en-us,medstar,High School diploma or GED,False,2025-08-21 21:39:57,"A Licensed or Non-Licensed Electrician installs basic electrical equipment and systems in accordance with all applicable plans, specifications, codes, and industry standards. Responsibilities include assembling, installing, testing, and maintaining electrical or electronic wiring, conduit, cable, equipment, components and devices associated with electrical equipment, following blueprints of electrical layouts and building plans. Installing and mounting electronic controls, device, panels, sensors, and components is a requirement. Performing interlock wiring as required, Testing electrical systems and continuity of circuits in electrical wiring, and inspecting installation sites are responsibilities as well. This role requires four (4) years of experience working in the electrical industry."
Electrician,27613,Dulles,Virginia,NA,NA,https://careers.mcdean.com/jobs/27613?lang=en-us,medstar,High School diploma or GED,False,2025-08-21 21:40:05,"A Licensed or Non-Licensed Electrician installs basic electrical equipment and systems in accordance with all applicable plans, specifications, codes, and industry standards. Responsibilities include assembling, installing, testing, and maintaining electrical or electronic wiring, conduit, cable, equipment, components and devices associated with electrical equipment, following blueprints of electrical layouts and building plans. Must successfully pass a background check and drug test. Possibility for mandatory overtime, which may fluctuate and include night and weekend work."
Engineering Leader,15008,"Leesburg, Richmond, Aldie, Boydton, Atlanta","Virginia, VA, Georgia, GA",$50 to ,NA,https://careers.mcdean.com/jobs/15008?lang=en-us,medstar,Bachelor’s degree,False,2025-08-21 21:40:13,"Engineering leader needed to manage the engineering aspects of procurement, construction for the delivery of electrical systems for mission critical facilities. Will provide engineering leadership for functional, physical, commissioning and project engineering aspects. Responsible for client ownership, engineering finances and engineering meetings. This is a technical leadership role; depends on the project’s stage. An engineering leader will be involved with electrical, power, and modular design. Must have a engineering degree related to construction (civil, mechanical, electrical, industrial, etc.)."
Safety Professional 1,28184,Leesburg,Virginia,NA,NA,https://careers.mcdean.com/jobs/28184?lang=en-us,medstar,Bachelors Degree,False,2025-08-21 21:40:20,"The Safety Professional is responsible for oversight of Construction Project Safety, Health and Risk Management. The role would be managing multiple Safety programs, developing and implementing M.C. Dean site-specific project safety plans, and collaborating with Project Management in the implementation and leadership of the Operational Risk Management (ORM) process. The candidate will be coordinating with General Contractor (GC) and/or owner of general site conditions and/or Non-Compliance Notice (NCN), advising of project-specific mitigation plans, safety training programs, and technical reports."
Control Engineer 3,28231,Leesburg,Virginia,NA,NA,https://careers.mcdean.com/jobs/28231?lang=en-us,medstar,"Master's degree in electrical engineering, automation engineering, or a related field; or Bachelor’s degree in electrical engineering, automation engineering, or a related field",False,2025-08-21 21:40:33,"Controls Engineers 3 are responsible for designing, developing, installing, and maintaining equipment used to monitor and control systems, machinery and processes. They work in various industries including industrial controls, water / wastewater, power controls and protection, and transportation systems. Responsible for designing and implementing solutions to our customer's complex needs."
Project Engineer 2,14663,Leesburg,Virginia,NA,NA,https://careers.mcdean.com/jobs/14663?lang=en-us,medstar,Bachelor of Science degree in Engineering or Master's in Engineering,False,2025-08-21 21:40:44,"The position involves providing technical & administrative information to others working on a project to ensure that the work complies with all general engineering standards, codes, specifications, and design instruction; trouble-shoots engineering related installation problems. The role is responsible for planning and executing project completion and punch list, preparing specifications for purchase of materials and equipment, preparing invoices, submitting O&M; manuals, assisting in development of full estimate, among other responsibilities."
"System Specialist, Associate",28396,Leesburg,Virginia,NA,NA,https://careers.mcdean.com/jobs/28396?lang=en-us,medstar,Bachelor's degree,False,2025-08-21 21:41:05,"We design, build, operate, and maintain cyber-physical solutions for the nation’s most mission-critical facilities, secure environments, complex infrastructure, and global enterprises. With over 7,000 employees, our capabilities span electrical, electronic security, telecommunications, life safety, automation and controls, audiovisual, and IT systems. Headquarters in Tysons, Virginia, M.C. Dean delivers resilient, secure, and innovative power and technology solutions through engineering expertise and smart systems integration."
"Project Controls, Senior",27914,Leesburg,Virginia,NA,NA,https://careers.mcdean.com/jobs/27914?lang=en-us,medstar,High School Diploma / GED or Associate's Degree or Bachelor's Degree or Master's degree,False,2025-08-21 21:41:14,"The Project Controls, Senior works with project leaders and project teams to analyze project data and define project schedules to ensure all project milestones are met. Takes ownership of driving the development and maintenance of all project artifacts that are required to ensure effective short-term and long-term staff forecasting, scheduling, and controls for the project. They will work with the project team to ensure all resources and skills needed based on the project tasks and schedule are recorded and tracked from baselines to update to closure of the project."
"Project Controls, Associate",28051,Leesburg,Virginia,NA,NA,https://careers.mcdean.com/jobs/28051?lang=en-us,medstar,"High School Diploma, Associate degree, Bachelor's degree",False,2025-08-21 21:41:24,"Project Controls, Associate is responsible for aiding, tracking, monitoring status, controlling and issue resolution throughout the projects life cycle. The job requires providing project planning and scheduling documentation to support project and customer requirements. One will also have to help Project Managers in creating short-term schedules, monitoring such schedules to determine impact on master schedule, and helping in formulating actions to correct scheduling problems. Involvement in proposal teams and tracking equipment maintenance using CMMS software is requisite."
Electrical Crew Leader,27611,Leesburg,Virginia,NA,NA,https://careers.mcdean.com/jobs/27611?lang=en-us,medstar,Highs School Degree or GED,False,2025-08-21 21:41:32,"Planning, organizing and scheduling crews to complete assigned work orders, including assigning tasks, assuring the work is being installed in a high-quality manner and performing quality inspections. Monitors task completion, compliance and prevents safety issues. The position requires the ability to lift, carry, and move objects weighing up to [50 pounds] on a regular basis. Candidates must demonstrate physical strength and stamina to perform various tasks, including but not limited to, loading, and unloading, operating equipment, and assisting in the transportation of various materials."
Electrical Foreman,27982,Leesburg,Virginia,NA,NA,https://careers.mcdean.com/jobs/27982?lang=en-us,medstar,"High School diploma or GED, Associate degree",False,2025-08-21 21:41:39,"An Electrical Foreman is responsible for planning, organizing and scheduling crews to complete assigned work orders, including assigning tasks, assuring the work is being installed in a high-quality manner and performing quality inspections. The position monitors task completion, compliance and prevents safety issues. This Job Requires 6+ years of experience in the electrical industry with a High School diploma or GED and 4+ years of experience with an Associate degree."
Safety Professional (College),15100,"Leesburg, Boydton, Richmond, Atlanta, Baltimore, Charleston","VA, VA, VA, GA, MD, SC",NA,NA,https://careers.mcdean.com/jobs/15100?lang=en-us,medstar,Bachelors Degree,False,2025-08-21 21:41:57,"The Safety Professional is responsible for oversight of Construction Project Safety, Health (S&H;), and Risk Management, effectively managing multiple Safety programs, developing and implementing M.C. Dean site-specific project safety plans, and collaborating with Project Management in the implementation and leadership of the Operational Risk Management (ORM) process. They will Coordinate with General Contractor (GC) and/or owner of general site conditions and/or Non-Compliance Notice (NCN). Participate in meetings with customers, project team members, and contractors/sub-contractors to advise of project-specific mitigation plans, S&H; training programs, and technical reports."
Quality Control 3,28243,Leesburg,Virginia,NA,NA,https://careers.mcdean.com/jobs/28243?lang=en-us,medstar,High school diploma / GED,False,2025-08-21 21:42:06,"M.C. Dean is Building Intelligence®. With more than 5,800 professionals worldwide, we design, build, operate, and maintain cyber-physical solutions for mission-critical facilities, secure environments, complex infrastructure, and global enterprises. This translates into fulfilling opportunities for employees driven to excel in a meaningful career. The Quality Control 3 is responsible for following the M.C. Dean Quality Control (QC) Program to achieve and verify quality expectations for a durable and reliable installation. The Quality Control 3 is responsible for performing field inspections to ensure work is in compliance with all safety policies and procedures."
Deputy Project Leader,27466,Leesburg,Virginia,"$500,000 to $10",NA,https://careers.mcdean.com/jobs/27466?lang=en-us,medstar,BS (Preferred EE or Industry related degree),False,2025-08-21 21:42:14,"The Deputy Project Leader is a position that consists of learning how to supervise and direct the employees on a particular project, prepare strategic plans and budgets, develop a comprehensive project plan, and analyze statistical data. Responsibilities include Run day-to-day operations of a project or sub-section of a project, identify and resolve change orders, track and manage variable costs, prepare the project completion and punch list, and read and interpret project blueprints and specifications."
Foreman 1,15027,Leesburg,Virginia,NA,NA,https://careers.mcdean.com/jobs/15027?lang=en-us,medstar,High School diploma or GED with 2 years as a Crew Leader or 4+ years of experience with an Associate degree,False,2025-08-21 21:42:25,"The Foreman is responsible for supervising and coordinating the work of a crew of technicians, apprentices and laborers on a job site as well as ensuring that all work installed is completed on time, on budget and according to all applicable plans, specifications, codes and industry standards. The foreman should assure his/her crew meets daily productivity benchmarks and is responsible for Quality control inspections of work completed."
Commissioning Engineer Associate,28007,Leesburg,Virginia,NA,NA,https://careers.mcdean.com/jobs/28007?lang=en-us,medstar,bachelor’s degree in related field,False,2025-08-21 21:42:35,"The Commissioning Engineer team is responsible for performing final testing, startup, and commissioning of low and medium voltage electrical distribution equipment, including breakers, transformers, switches, switchgear, relays, and motor control centers, as well as other electrical apparatus both in the field and in a manufacturing environment. An understanding of sophisticated electrical distribution systems of complex electrical test equipment is required. You will contribute to a safe working environment for co-workers and customers and help ensure the overall success of projects."
Estimator 1,14958,Leesburg,Virginia,NA,NA,https://careers.mcdean.com/jobs/14958?lang=en-us,medstar,"Bachelor's degree from an accredited college or university in Engineering, preferably Electrical Engineering or Associate's Degree with 4-6 years of experience or high school diploma or GED with 6-8 years experience",False,2025-08-21 21:42:52,"The Level I Estimator assists more experienced estimators in preparing cost estimates for bids and proposals for electrical and other low voltage applications such as fire alarm systems, security systems, communication systems, paging systems, audio-visual systems and nurse-call systems. Job responsibilities include but are not limited to: Gathering data and assisting in preparing bid proposal estimates and design/build proposals. Performing take-offs from drawings; pricing change orders and conducting site visits to understand the constructability of projects. Understanding plans and specifications to identify the types and grades of materials and equipment needed and to ensure compliance with project requirements."
Electrical Apprentice,14870,Sterling,Virginia,NA,NA,https://careers.mcdean.com/jobs/14870?lang=en-us,medstar,High School diploma or GED,False,2025-08-21 21:43:00,"An Electrician Apprentice assists in the installation of electrical equipment in accordance with all applicable plans, specifications, codes and industry standards. You will assist with assembling, installing, testing, and maintaining electrical or electronic wiring, conduit, cable, equipment, components and devices associated with electrical equipment, following blueprints of electrical layouts and building plans. Installing and mounting electronic controls, device, panels, sensors, and components."
Electronics Technician 4,27881,Chantilly,Virginia,NA,NA,https://careers.mcdean.com/jobs/27881?lang=en-us,medstar,HS diploma or GED,False,2025-08-21 21:43:11,"Job requires the installation and maintenance of electronic security systems. Preventive maintenance, evaluations, and inventory tasks are among the responsibilities. Moreover, the role requires leading teams on large complex installation projects. Requires programming and installation of head end equipment for Access Control, Intrusion Detection and CCTV systems. Applicant need to have an active top secret clearance. Travel may be required up to 50% of the time. Some physical duties might be part of the role as well including lifting up to 50 pounds, climbing scaffolds and ladders, and assisted relocation of a 12 foot stepladder."
Electronics Technician 3,27673,Chantilly,VA,NA,NA,https://careers.mcdean.com/jobs/27673?lang=en-us,medstar,HS diploma or GED Military Electronics Training (minimum 720 classroom hours) or Graduation from an accredited Electronics Technician program or Graduation from an Electrical Apprenticeship program,False,2025-08-21 21:43:19,"We're seeking people driven to excellence and inspired to have a meaningful impact powering, automating, integrating, and securing the world’s most critical infrastructure and facilities. We are seeking an Electronics Technician 3 to join our Security and Electronic Systems (SES) business Unit. You will be responsible for installing and maintaining electronic security systems. Performing preventive maintenance requirements. Leading teams on small moderately complex installation projects."
DevOps Technical Specialist (Tech Specialist 6),27537,Chantilly,Virginia,NA,NA,https://careers.mcdean.com/jobs/27537?lang=en-us,medstar,"High School Diploma with 18+ years of experience with installation, troubleshooting and/or testing of electronic security systems or Associates with 15+ years of experience or Bachelor's Degree with 12+ years experience or Master's Degree with 9+ years experience",False,2025-08-21 21:43:30,"We are seeking an **Technical Security Specialist 4 **to join our **Security and Electronic Systems (SES)** business Unit. As part of **(SES)** Strategic Business Unit you will be part of a team that designs, engineers, integrates, operates and maintains electronic security services inclusive of intrusion detection, access control, biometric authentication, video surveillance, audio visual, it systems, perimeter defense and command and control systems for federal, local and commercial customers across high-growth markets."
Electronics Technician 2,27672,Chantilly,Virginia,NA,NA,https://careers.mcdean.com/jobs/27672?lang=en-us,medstar,HS diploma or GED Military Electronics Training (minimum 720 classroom hours) or Graduation from an accredited Electronics Technician program or Graduation from an Electrical Apprenticeship program,False,2025-08-21 21:43:39,"We are seeking an Electronics Technician 2 to join our Security and Electronic Systems (SES) business Unit. As part of (SES) Strategic Business Unit you will be part of a team that designs, engineers, integrates, operates and maintains electronic security services inclusive of intrusion detection, access control, biometric authentication, video surveillance, audio visual, it systems, perimeter defense and command and control systems for federal, local and commercial customers across high-growth markets."
Access Control Officer,27969,Chantilly,Virginia,NA,NA,https://careers.mcdean.com/jobs/27969?lang=en-us,medstar,High school diploma with two years of experience,False,2025-08-21 21:43:46,"The Access Control Officer is a customer-facing position responsible for issuing badges and providing support services at designated facilities in accordance with established security procedures. This role plays a critical part in maintaining a secure and welcoming environment for all personnel and visitors. The position requires a high level of attention to detail, strong communication skills, and the ability to manage multiple tasks. It is ideal for individuals who thrive in dynamic environments, enjoy interacting with people, and are committed to upholding security standards."
