job_title,job_id,city,state,salary,posted_date,job_url,company,education_needed,is_remote,last_scanned_at,description
HR Business Partner Principal,27492,Tysons,Virginia,NA,NA,https://careers.mcdean.com/jobs/27492?lang=en-us,medstar,Bachelor’s degree,False,2025-08-21 16:39:55,"M.C. Dean is Building Intelligence®. With more than 6,000+ professionals worldwide, we design, build, operate, and maintain cyber-physical solutions for mission-critical facilities, secure environments, complex infrastructure, and global enterprise As an employee at M.C. Dean, you will join forces with more than 5,800 professionals who engineer and deploy automated, secure and resilient power and technology systems; and deliver the management platforms essential for long-term system sustainability. Together, we transform the way complex, large-scale systems are designed, delivered, and sustained–enhancing client outcomes, improving lives, and changing the world for the better."
BOC Specialist 4,28366,Alexandria,VA,NA,NA,https://careers.mcdean.com/jobs/28366?lang=en-us,medstar,High school diploma or GED,False,2025-08-21 16:40:05,"M.C. Dean is seeking a dedicated and skilled BOC (Building Operations Center) Specialist/Operator to join our 24/7/365 team. As a BOC Specialist/Operator, you will be responsible for continuously monitoring, operating, and optimizing building automation systems (BAS) to maximize efficiency, ensure occupant comfort, and maintain critical operations. You will play a crucial role in identifying and resolving issues, responding to alarms and service calls, and implementing strategies for long-term system improvements. The candidate should have experience in DDC Controls, HVAC Systems, Building Automation Systems (BAS), and troubleshooting, among others. Ability to read and interpret technical documentation is required."
IDIQ Project Controller,28314,Alexandria,Virginia,NA,NA,https://careers.mcdean.com/jobs/28314?lang=en-us,medstar,High school diploma or GED,False,2025-08-21 16:40:16,"M.C. Dean is Building Intelligence®. We design, build, operate, and maintain cyber-physical solutions for the nation’s most recognizable mission critical facilities, secure environments, complex infrastructure, and global enterprises. The IDIQ Project Controller will oversee and support Indefinite Delivery/Indefinite Quantity(IDIQ) projects, ensuring seamless project execution from inception to completion. This role requires the ability to effectively plan, organize, and manage all aspects of the construction process, including scheduling, budgeting, quality control, safety, and project closeout. The ideal candidate will excel in subcontractor coordination, schedule management, and fieldexecution."
Project Leader 1,14666,Aldie,Virginia,NA,NA,https://careers.mcdean.com/jobs/14666?lang=en-us,medstar,"Bachelor’s degree in Electrical Engineering, Mechanical Engineering, Construction Management or Master’s degree",False,2025-08-21 16:40:25,"The Project Manager I is responsible for the overall administration, organization and implementation of small electrical construction projects or parts of larger more complex project. This involves assisting the project Superintendent in the preparation of project documentation requirements, project layout, and field office support. Other responsibilities include developing a resource loaded CPM schedule with time scale logic, coordinating project kick-off meetings, and forecasting cash flow and manpower needs for projects. The role requires a background in Electrical Engineering, Mechanical Engineering, Construction Management with 7-9 years of experience (Bachelor’s degree) or 5-7 years (Master’s degree)."
Commercial Service Technician 1,27417,Annapolis,Maryland,$26.00 - ,NA,https://careers.mcdean.com/jobs/27417?lang=en-us,medstar,High School Diploma or GED,False,2025-08-21 16:40:37,"M.C. Dean is Building Intelligence®. We design, build, operate, and maintain cyber-physical solutions for the nation’s most recognizable mission critical facilities, secure environments, complex infrastructure, and global enterprises. The company’s capabilities include electrical, electronic security, telecommunications, life safety, automation and controls, audio visual, and IT systems. The selected candidate will be working as an Electrical Service Technician for M.C. Dean’s Service & National Accounts Group. This Group operates 24/7 - 365 to support our customers and is known for being the best in class for providing The Ultimate Customer Experience."
Lighting Technician 1,27418,Annapolis,MD,$17.40 - ,NA,https://careers.mcdean.com/jobs/27418?lang=en-us,medstar,High School Diploma or GED,False,2025-08-21 16:40:48,"M.C. Dean is Building Intelligence®. We design, build, operate, and maintain cyber-physical solutions for the nation’s most recognizable mission critical facilities, secure environments, complex infrastructure, and global enterprises. The company’s capabilities include electrical, electronic security, telecommunications, life safety, automation and controls, audio visual, and IT systems. The selected candidate will be working for the National Accounts department within M.C. Dean. The selected candidate will be responsible for electrical lighting maintenance scope which will include changing bulbs, ballasts, and drivers on existing lighting fixtures."
Network Administrator 2,28179,Annapolis Junction,Maryland,"$86,720 -",NA,https://careers.mcdean.com/jobs/28179?lang=en-us,medstar,Bachelor's Degree and 2+ Years of progressive experience or Associates Degree and 6+ Years of progressive experience or HS Diploma or Equivalent and 8+ Years of progressive experience,False,2025-08-21 16:40:59,"M.C. Dean, Inc is hiring a **Network Administrator 2** for a full-time onsite position in Annapolis Junction, MD. The job requires an active TS/SCI w/ polygraph clearance. The Network Administrator will be tasked with supporting network documentation, support planning, installing, configuring, and operating complex networks. They will also support planning and implementation of VPN solutions and management of hardware firmware revisions. Current certification in either Cisco Certified Network Associate (CCNA) or CompTIA Network+ is required."
System Administrator 5,28363,Annapolis Junction,Maryland,"$149,840 - $224,760",NA,https://careers.mcdean.com/jobs/28363?lang=en-us,medstar,"Associate's degree with 13+ years of experience in programs and contracts of similar scope, type, and complexity, a Bachelor's degree with 10+ years of experience, or 7+ years of experience with a Masters.",False,2025-08-21 16:41:08,"We are seeking a System Administrator 5 to join our Security and Electronic Systems (SES) business Unit. As part of SES Strategic Business Unit you will be part of a team that designs, engineers, integrates, operates and maintains electronic security services inclusive of intrusion detection, access control, biometric authentication, video surveillance, audio visual, it systems, perimeter defense and command and control systems for federal, local and commercial customers across high-growth markets."
System Administrator 4,28362,Annapolis Junction,Maryland,"$124,880 - $187,320",NA,https://careers.mcdean.com/jobs/28362?lang=en-us,medstar,"HS Diploma with 12+ years of experience, or Associate's degree with 10+ years of experience in programs and contracts of similar scope, type, and complexity, a Bachelor's degree with 7+ years of experience, or 5+ years of experience with a Masters. Of which 3 years of experience is required with the provision of SE services for physical security system and IT solutions.",False,2025-08-21 16:41:25,"M.C. Dean, Inc is seeking a System Administrator 4 to join their Security and Electronic Systems (SES) business Unit. The role involves the design, engineering, integration, operation, and maintenance of electronic security services inclusive of intrusion detection, access control, biometric authentication, video surveillance, audiovisual, IT systems, perimeter defense and control systems for federal, local, and commercial customers. The role also requires cross-discipline coordination, system design solutions that satisfy system requirements, and performing technical/non-technical assessment."
Database Administrator 5,28135,Annapolis Junction,Maryland,"$149,840 - $224,760",NA,https://careers.mcdean.com/jobs/28135?lang=en-us,medstar,Bachelor's degree,False,2025-08-21 16:41:39,"Seeking a senior Database Administrator 5 that is able to work with a dynamic team of system engineers and administrators responsible for design, implementation, operations & maintenance, and cybersecurity for large complex resilient hardware and virtualized infrastructure. This position maintains the integrity, security and availability of multiple database(s). Duties include disaster recovery, performance analysis and tuning, index maintenance, and monitoring of data."
Database Administrator 3,28133,Annapolis Junction,Maryland,"$104,080 - $156,120",NA,https://careers.mcdean.com/jobs/28133?lang=en-us,medstar,Bachelor's degree in an Information Technology (IT) discipline from an accredited college or university and 5+ years of experience. OR 8+ years of experience with Associate’s Degree.,False,2025-08-21 16:41:57,"Database Administrator 3 that is able to work with a dynamic team of system engineers and administrators responsible for design, implementation, operations & maintenance, and cybersecurity for large complex resilient hardware and virtualized infrastructure. This position supports maintenance of the integrity, security and availability of multiple database(s). Duties include disaster recovery, performance analysis and tuning, index maintenance, and monitoring of data."
Systems Engineer 4,28134,Annapolis Junction,Maryland,"$124,880 - $187,320",NA,https://careers.mcdean.com/jobs/28134?lang=en-us,medstar,"BS Degree in Computer Science, Electrical Engineering, Mechanical, or a Related Engineering Discipline. Master’s Degree desirable.",False,2025-08-21 16:42:21,"M.C. Dean is seeking a System Engineer. The candidate will be part of a dynamic team responsible for design, implementation, operations & maintenance, and cybersecurity for large complex resilient hardware and virtualized infrastructure. The position drives the design of architectural frameworks for large complex resilient systems to ensure implemented solutions meet stakeholder needs, standards, and performance requirements. Candidates will conduct systems requirements reviews, develop concepts of operation and interface standards, developing system architectures, and perform technical/non-technical assessment and management as well as end-to-end flow analysis."
Network Administrator 3,27014,Annapolis Junction,Maryland,"$104,080 - $156,120",NA,https://careers.mcdean.com/jobs/27014?lang=en-us,medstar,Bachelor's Degree and 5+ Years of progressive experience OR Associates Degree and 8+ Years of progressive experience OR HS Diploma or Equivalent and 10+ Years of progressive experience,False,2025-08-21 16:42:33,"We're seeking people driven to excellence and inspired to have a meaningful impact powering, automating, integrating, and securing the world’s most critical infrastructure and facilities. As an employee at M.C. Dean, you will join forces with more than 5,800 professionals who engineer and deploy automated, secure and resilient power and technology systems; and deliver the management platforms essential for long-term system sustainability. We are seeking a Network Administrator 3 to join our Security and Electronic Systems (SES) business Unit. As part of SES Strategic Business Unit you will be part of a dynamic team responsible for design, implementation, operations & maintenance, and cybersecurity for large complex resilient hardware and virtualized infrastructure to ensure implemented solutions meet stakeholder needs, standards, and performance requirements."
System Administrator 2,27064,Annapolis Junction,Maryland,"$86,720 - $130,080",NA,https://careers.mcdean.com/jobs/27064?lang=en-us,medstar,Bachelor's Degree and 2+ Years of progressive experience or Associates Degree and 6+ Years of progressive experience or HS Diploma or Equivalent and 8+ Years of progressive experience,False,2025-08-21 16:42:43,"We're seeking people driven to excellence and inspired to have a meaningful impact powering, automating, integrating, and securing the world’s most critical infrastructure and facilities. We are seeking a System Administrator 2 to join our Security and Electronic Systems (SES) business Unit. In this role you will be working as part of a team to monitor, maintain, and test Physical Access Control, CCTV, PSIM and other electronic security systems and support implementation, troubleshooting and maintenance of Information Technology (IT) systems in support of the endpoint devices."
Licensed Commercial Service Technician 1 (Project),14464,Alexandria,Virginia,NA,NA,https://careers.mcdean.com/jobs/14464?lang=en-us,medstar,HS diploma/GED,False,2025-08-21 16:42:53,"M.C. Dean is Building Intelligence®. The company’s capabilities include electrical, electronic security, telecommunications, life safety, automation and controls, audio visual, and IT systems. The selected candidate will be working as an Electrical Service / UPS installation systems Technician for M.C. Dean’s Service & National Accounts Group. This position may require ongoing or intermittent use of a company vehicle. Must successfully pass a background check and drug test."
Commercial Service Technician 1,14463,Alexandria,Virginia,NA,NA,https://careers.mcdean.com/jobs/14463?lang=en-us,medstar,HS diploma/GED,False,2025-08-21 16:43:09,"M.C. Dean is Building Intelligence. We design, build, operate, and maintain cyber-physical solutions for the nation's most recognizable mission critical facilities, secure environments, complex infrastructure, and global enterprises. The selected candidate will be working as an Electrical Service / UPS installation systems Technician for M.C. Dean's Service & National Accounts Group. This Group operates 24/7 - 365 to support our customers. You will be responsible for electrical installations, of UPS installs servicing basic electrical equipment and systems in accordance with all applicable plans, specifications, and codes."
Electronics Technician 4,27663,Fort Meade,Maryland,$36.00 - ,NA,https://careers.mcdean.com/jobs/27663?lang=en-us,medstar,HS diploma or GED Military Electronics Training (minimum 720 classroom hours) or Graduation from an accredited Electronics Technician program or Gradification from an Electrical Apprenticeship program,False,2025-08-21 16:43:32,"We are seeking an Electronics Technician 4 to join our Security and Electronic Systems (SES) business Unit. In this role you will be responsible for installing and maintaining electronic security systems. Performing preventive maintenance requirements. Performing inspections, evaluations, and inventory. Leading teams on Large complex installation projects with limited supervision. Installing and Maintain equipment at both the local and global level per design packages."
Senior Procurement Agent 4,15087,Fort Meade,Maryland,NA,NA,https://careers.mcdean.com/jobs/15087?lang=en-us,medstar,Bachelor's degree,False,2025-08-21 16:43:45,"As a Senior Purchasing Agent supporting MC Dean’s growing businesses, your role will include: Functioning as a key liaison between the Procurement team and internal stakeholders including MC Dean’s Executive Team, Engineering, Sales, and Manufacturing. Working closely with the core Program/Project teams to manage high visibility and high value programs, applying program/project management skills to assure the timely and efficient execution of MC Dean’s portfolio of projects."
"Electronics Technician 2 - Ft Meade, MD",27660,Fort Meade,Maryland,$30.00 - ,NA,https://careers.mcdean.com/jobs/27660?lang=en-us,medstar,HS diploma or GED Military Electronics Training,False,2025-08-21 16:44:12,"We are seeking an Electronics Technician 2 to join our Security and Electronic Systems (SES) business Unit. As part of (SES) Strategic Business Unit you will be part of a team that designs, engineers, integrates, operates and maintains electronic security services inclusive of intrusion detection, access control, biometric authentication, video surveillance, audio visual, it systems, perimeter defense and command and control systems for federal, local and commercial customers across high-growth markets. Executes various technical tasks and responsibilities within field operations. Performs on-site installations, maintenance, troubleshooting, and repairs of equipment and systems. Ensures the functionality and reliability of various technologies."
Electronics Technician 3,27664,Fort Meade,Maryland,$32.00 - ,NA,https://careers.mcdean.com/jobs/27664?lang=en-us,medstar,HS diploma or GED Military Electronics Training (minimum 720 classroom hours) or Graduation from an accredited Electronics Technician program or Graduation from an Electrical Apprenticeship program,False,2025-08-21 16:44:44,"We are seeking an Electronics Technician 3 to join our Security and Electronic Systems (SES) business Unit. The technician executes various technical tasks and responsibilities within field operations. Duties include conducting site surveys, configuring hardware and software, testing systems for proper operation, and providing technical support to customers. Technicians must possess strong problem-solving skills, technical proficiency, and the ability to communicate effectively with clients and team members."
"Electronics Technician 1 - Ft Meade, MD",27661,Fort Meade,Maryland,$26.00 - ,NA,https://careers.mcdean.com/jobs/27661?lang=en-us,medstar,HS diploma or GED Military Electronics Training (minimum 720 classroom hours),False,2025-08-21 16:44:55,"We're seeking people driven to excellence and inspired to have a meaningful impact powering, automating, integrating, and securing the world’s most critical infrastructure and facilities. As an employee at M.C. Dean, you will join forces with more than 5,800 professionals who engineer and deploy automated, secure and resilient power and technology systems. We are seeking an Electronics Technician 1 to join our Security and Electronic Systems (SES) business Unit. The position requires the ability to lift, carry, and move objects weighing up to [50 pounds] on a regular basis."
"Network Administrator 3 - Fort Meade, MD",28232,Fort Meade,Maryland,"$104,080.00 - ",NA,https://careers.mcdean.com/jobs/28232?lang=en-us,medstar,High School Diploma/GED with 10+ years of experience or Associate's Degree with 8+ years of experience or Bachelor's Degree with 5+ years of experience,False,2025-08-21 16:45:22,"M.C. Dean is seeking a highly competent TS/SCI with Polygraph cleared Network Administrator 3 to assist on the design and maintenance of its network of specialized hardware. Implementing various network technologies and end-user support. Experience in the use of routing protocols and switching technologies, LAN/WAN medias and protocols. Strong communications, time management, and organization skills to meet deadlines and quality objectives."
Senior Commissioning Engineer,28273,Fort Meade,Maryland,"$104,080.00 - ",NA,https://careers.mcdean.com/jobs/28273?lang=en-us,medstar,Bachelor’s degree in Engineering,False,2025-08-21 16:45:37,"The Commissioning Engineer team is responsible for performing final testing, startup, and commissioning of low and medium voltage electrical distribution equipment, including breakers, transformers, switches, switchgear, relays, and motor control centers, as well as other electrical apparatus both in the field and in a manufacturing environment. You will contribute to a safe working environment for co-workers and customers and help ensure the overall success of projects. Local, regional, and national travel may be required."
Electronics Technician 3,27665,Laurel,Maryland,$32.00 - ,NA,https://careers.mcdean.com/jobs/27665?lang=en-us,medstar,"HS diploma or GED, Military Electronics Training (minimum 720 classroom hours), Graduation from an accredited Electronics Technician program, Graduation from an Electrical Apprenticeship program",False,2025-08-21 16:45:48,"The job involves conducting site surveys, configuring hardware and software, testing systems for proper operation, and providing technical support to customers. It requires strong problem-solving skills, technical proficiency, and the ability to communicate effectively with clients and team members. Key duties include enforcing M.C. Dean handbook and policies, analyzing and interpreting drawing packages for constructability, tracking project metrics, verifying correct charges in timesheets, and executing installation and maintenance activities."
Fire Alarm Inspector 4,27941,Arlington,Virginia,NA,NA,https://careers.mcdean.com/jobs/27941?lang=en-us,medstar,High school diploma with minimum 8 + years of related experience or Technology Degree with 6+ years of related experiences,False,2025-08-21 16:46:03,"As a Fire Alarm Inspector 4, you will represent the highest level of technical expertise and leadership in inspections, testing and preventive maintenance of fire alarm systems. This is a senior position within the testing team, responsible for leading complex projects, providing strategic guidance, and mentoring junior technicians. The role involves overseeing critical system inspections, resolving intricate technical challenges, and ensuring the superior performance and compliance of fire alarm systems."
System Administrator 1,28369,Arlington,Virginia,NA,NA,https://careers.mcdean.com/jobs/28369?lang=en-us,medstar,HS Diploma or Equivalent and 6+ Years of progressive experience,False,2025-08-21 16:46:13,"Job involves monitoring, maintaining, and testing of Physical Access Control, CCTV, PSIM and Integrated Electronic Systems. This position is maintained at a single on-site work location. Options for different shift times are available. Applicants selected will be subject to a government security investigation and must meet eligibility requirements, including U.S. Citizenship, for access to classified information. Therefore, an active SECRET Clearance is REQUIRED."
System Administrator 2,28370,Arlington,Virginia,NA,NA,https://careers.mcdean.com/jobs/28370?lang=en-us,medstar,"2+ Years of Experience with a Bachelor's Degree in Information Technology, Risk Management, Cybersecurity preferred or 6+ Years of Experience with an Associate's Degree in Information Technology, Risk Management, Cybersecurity preferred or 8+ Years of Experience with a High School Diploma",False,2025-08-21 16:46:25,"The job role of a System Administrator involves monitoring, maintaining, testing of Physical Access Control, CCTV, PSIM, and Integrated Electronic Systems in the Washington D.C. area. The role requires system administrator experience in performing triage on system problems, resolving the system problems, analyzing system data to prevent problems, and implementing new workstations, and system extensions. Eligibility criteria includes active SECRET Clearance, a basic knowledge of large scale networking, VLANS and routing, the ability to work flexible shifts, Security + Certification, and strong oral, written and presentation skills."
Engineer 4,28378,Arlington,Virginia,NA,NA,https://careers.mcdean.com/jobs/28378?lang=en-us,medstar,Bachelor's Degree with 7+ years experience or Master's Degree with 5+ years experience,False,2025-08-21 16:46:38,"M.C. Dean is seeking an Engineer 4 to join their Security and Electronic Systems (SES) business Unit. The responsibilities include analyzing system performance and recommending improvements, providing support to the system administration and engineering team, Communicating with customers, manufacturers, vendors and system administrators. They will also be required to train system users and other system support personnel, troubleshoot system performance issues and implement corrective actions. The position requires expertise in VMS/CCTV systems (Bosch, Milestone, and Genetec) and working knowledge of Electrical Security Systems, including: ACS, PSIM, PIDS, IDS."
Fire Alarm Senior Service Technician,27954,Arlington,Virginia,NA,NA,https://careers.mcdean.com/jobs/27954?lang=en-us,medstar,High school diploma or Technology Degree,False,2025-08-21 16:46:46,"The role of a Fire Alarm Senior Service Technician represents the highest level of technical expertise and leadership in fire alarm system servicing. This is a senior position within the team, responsible for leading complex projects, providing strategic guidance, and mentoring junior technicians. The role involves overseeing critical system inspections, resolving intricate technical challenges, and ensuring the superior performance and compliance of fire alarm systems. The position requires the ability to lift, carry, and move objects weighing up to 50 pounds on a regular basis."
