job_title,job_id,city,state,salary,posted_date,job_url,company,education_needed,is_remote,last_scanned_at,description
Senior Procurement Agent 3,14653,Tysons,Virginia,NA,NA,https://careers.mcdean.com/jobs/14653?lang=en-us,medstar,Bachelor's degree,False,2025-08-21 22:05:56,"As a Senior Purchasing Agent supporting MC Dean’s growing businesses, your role will include: Functioning as a key liaison between the Procurement team and internal stakeholders including MC Dean’s Executive Team, Engineering, Sales, and Manufacturing. Working closely with the core Program/Project teams to manage high visibility and high value programs, applying program/project management skills to assure the timely and efficient execution of MC Dean’s portfolio of projects."
Proposal Manager 4,14633,Tysons,Virginia,NA,NA,https://careers.mcdean.com/jobs/14633?lang=en-us,medstar,Bachelor's degree,False,2025-08-21 22:06:04,"M.C. Dean is seeking a highly motivated proposal manager to join our team in Tysons, Virginia. This position offers the career-minded individual the opportunity to be a team leader, supporting high profile proposals across multiple operating divisions and disciplines throughout the company. M.C. Dean provides large-scale systems and systems integration solutions for federal, defense and national security clients; state and local governments; and Fortune 100 technology, healthcare and industrial corporations."
Engineering Return Internship Program (CIS),28304,"Tysons, Aldie, Boydton, Richmond, Caroline County, Ruther Glen, Manassas, Leesburg, Baltimore, Riverdale, Atlanta","Virginia, Maryland, Georgia",$18.00 - ,NA,https://careers.mcdean.com/jobs/28304?lang=en-us,medstar,Currently enrolled in a bachelor’s degree program or higher in engineering or similar discipline,False,2025-08-21 22:06:16,"M.C. Dean is Building Intelligence™. We design, build, operate, and maintain cyber-physical solutions for the nation’s most mission-critical facilities, secure environments, complex infrastructure, and global enterprises. Our Engineering Interns will have access to a wide range of technical fields supporting real world projects that help our customers shape the modern world. Interns will gain experience working side-by-side with experienced professionals in our labs, on project sites, or in our manufacturing facility to put their problem solving and creativity to work."
Safety Professional 2,14547,Tysons,Virginia,NA,NA,https://careers.mcdean.com/jobs/14547?lang=en-us,medstar,"High school diploma, Associates Degree, Bachelors Degree",False,2025-08-21 22:06:32,"We're seeking people driven to excellence and inspired to have a meaningful impact powering, automating, integrating, and securing the world’s most critical infrastructure and facilities. This translates into fulfilling opportunities for employees driven to excel in a meaningful career. We are seeking a Safety Professional 2 to join our Security and Electronic Systems (SES) business Unit. As part of (SES) Strategic Business Unit you will be part of a team that designs, engineers, integrates, operates and maintains electronic security services inclusive of intrusion detection, access control, biometric authentication, video surveillance, audio visual, it systems, perimeter defense and command and control systems for federal, local and commercial customers across high-growth markets."
Sr. Procurement Manager,14019,Tysons,Virginia,NA,NA,https://careers.mcdean.com/jobs/14019?lang=en-us,medstar,Bachelor's degree,False,2025-08-21 22:06:40,"As a Senior Subcontract Procurement Manager supporting M.C. Dean’s growing businesses, you will be responsible for managing construction industry subcontracts and services spends in support of the SCS division. This role will require 30-50% travel to job sites. The core objectives of this role are: Functioning as a key liaison between the Procurement team and internal stakeholders including MC Dean’s Executive Team, Engineering, Sales, and Manufacturing. Working closely with the core Program/Project teams to manage high visibility and high value programs, applying program/project management skills to assure the timely and efficient execution of MC Dean’s portfolio of projects."
Technical Specialist 2 (Telecommunications),27201,Tysons,Virginia,NA,NA,https://careers.mcdean.com/jobs/27201?lang=en-us,medstar,"Associate’s degree in an engineering discipline from an ABET-accredited University preferred, with a minimum of 6+ years experience in the telecommunications industry or A High School Diploma or GED with a minimum of 8+ years experience in the telecommunications industry",False,2025-08-21 22:06:49,"The **Technical Specialist 2 (Telecommunications)** position may include Bids & Proposals Development, Design Documents Coordination and Development, Construction Documents Coordination and Development, Field Coordination, Commissioning, and Testing for Telecommunications Information Transport Systems. telecommunications low voltage systems, and associated infrastructure for small to large scale projects. The **Technical Specialist 2 (Telecommunications)** shall also create, maintain, and manage various engineering planning documents."
Corporate Accounting Analyst,27430,Tysons,Virginia,NA,NA,https://careers.mcdean.com/jobs/27430?lang=en-us,medstar,B.S. in Accounting or Finance,False,2025-08-21 22:06:56,"We're seeking people driven to excellence and inspired by the way engineering and innovation improves lives, enhances customer outcomes, and changes the world for the better. As an employee at M.C. Dean, you will join forces with more than 5,100 professionals who engineer and deploy automated, secure and resilient power and technology systems; and deliver the management platforms essential for long-term system sustainability."
Small & Disadvantaged Business Compliance Specialist (Procurement Agent Associate),28241,Tysons,Virginia,NA,NA,https://careers.mcdean.com/jobs/28241?lang=en-us,medstar,"Bachelor’s degree or higher in supply chain management, business
administration, engineering, or similar discipline",False,2025-08-21 22:07:06,"M.C. Dean is seeking a Small & Disadvantaged Business Compliance Specialist. Key responsibilities include sourcing and evaluating suppliers, on-boarding and supplier integration, compliance monitoring and reporting, program and event management, and regulatory adherence and knowledge sharing. The candidate must have a Bachelor’s degree or higher in a relevant field, strong knowledge of procurement processes and supplier management, excellent communication and negotiation skills, and the ability to understand technical specifications and requirements."
Systems Engineer 5,28138,Tysons,Virginia,NA,NA,https://careers.mcdean.com/jobs/28138?lang=en-us,medstar,Bachelor’s Degree,False,2025-08-21 22:07:15,"The position drives the design of architectural frameworks for large complex resilient systems to ensure implemented solutions meet stakeholder needs, standards, and performance requirements. Assists with automation and optimization of engineering processes; diagnoses and remediates complex systems availability; and researches, prototypes, and develops emerging technologies by working closely with industry partners and OEMs to implement the latest capabilities. This role also conducts systems engineering assessments, develops conceptual design solutions and creates implementation work breakdown structures."
Engineering Return Internship Program (VDC),28301,"Tysons, Aldie, Boydton, Richmond, Caroline County, Ruther Glen, Manassas, Leesburg, Baltimore, Riverdale, Atlanta","Virginia, Maryland, Georgia",$18.00 - ,NA,https://careers.mcdean.com/jobs/28301?lang=en-us,medstar,Bachelor of Science degree in engineering or similar discipline,False,2025-08-21 22:07:26,"Our Engineering Interns will have access to a wide range of technical fields supporting real world projects that help our customers shape the modern world. Interns will gain experience working side-by-side with experienced professionals in our labs, on project sites, or in our manufacturing facility to put their problem solving and creativity to work. The Engineering Internship Program also offers opportunities to pursue certifications, land new skills, and network with mentors and organizational leadership. Incoming Engineering Interns can support Automation Systems, Critical Infrastructure Solutions, Electrical Systems, Facilities Engineering Operations & Maintenance, Integrated Infrastructure & Communications Systems, Life Safety, Security & Electronic Systems."
Dean | Fluor Critical Facilities Technician- (Control Room) -Vienna VA,14378,Tysons,Virginia,NA,NA,https://careers.mcdean.com/jobs/14378?lang=en-us,medstar,High school diploma,False,2025-08-21 22:07:44,"Dean | Fluor is looking for a Critical Facilities (Control Room) Technician to join our operations team in the operations and maintenance of a mission-critical government data center. The technician is responsible for ensuring that all electrical, mechanical, HVAC, and fire/life safety equipment within the data center is operating at peak efficiency. The technician is responsible for performing highly diversified duties to operate, troubleshoot, and maintain facility equipment according to preventative, predictive and corrective maintenance procedures."
Engineering Return Internship Program (LSG),28307,"Tysons, Aldie, Boydton, Richmond, Caroline County, Ruther Glen, Manassas, Leesburg, Baltimore, Riverdale, Atlanta","Virginia, Virginia, Virginia, Virginia, Virginia, Virginia, Virginia, Virginia, Maryland, Maryland, Georgia",$18.00 - ,NA,https://careers.mcdean.com/jobs/28307?lang=en-us,medstar,Currently enrolled in a Bachelor of Science degree program in engineering or similar discipline,False,2025-08-21 22:08:00,"M.C. Dean is Building Intelligence. We design, build, operate, and maintain cyber-physical solutions for the nation’s most mission-critical facilities, secure environments, complex infrastructure, and global enterprises. Our people are passionate about engineering innovation that improves lives and drives impactful change. Guided by our core values—agility, expertise, and trust—we foster a collaborative and forward-thinking work environment. at M.C. Dean, we are committed to building the next generation of technical leaders in electrical, engineering, and cybersecurity industries."
Control Engineer 3,26934,Tysons,Virginia,NA,NA,https://careers.mcdean.com/jobs/26934?lang=en-us,medstar,"Master's degree in electrical engineering, automation engineering, or a related field with 3+ years of experience, or Bachelor’s degree in electrical engineering, automation engineering, or a related field with 5+ years of experience",False,2025-08-21 22:08:12,"Controls Engineers 3 are responsible for designing, developing, installing, and maintaining equipment used to monitor and control systems, machinery and processes in various industries such as industrial controls, water / wastewater, power controls and protection, and transportation systems. Their role includes design/engineering, programming, testing/troubleshooting/deployment/commissioning, and maintenance tasks. They also have managerial responsibilities such as cost estimation, personnel management, and client servicing. They work with programming languages like ladder logic and structured text and deal with software like CAD/CAE Software, Microsoft Office, and other platform-specific tools."
Compensation Manager,28056,Tysons,Virginia,NA,NA,https://careers.mcdean.com/jobs/28056?lang=en-us,medstar,"Bachelor’s Degree in Human Resources, Business Administration, Mathematics, Finance, or related field. Master's degree with 6+ years of experience.",False,2025-08-21 22:08:21,"In this role, you’ll utilize your deep subject matter expertise in compensation design, analytics and theory to serve as a strategic client-facing consultant to our executive business leaders and stakeholders. You will not only have the opportunity to analyze and identify compensation issues, but drive them to resolution with your strong communication, problem-solving, and influencing skills. Our client is looking for an experienced compensation manager in the ultra-competitive Cyber-physical, Information Technology & Intelligent Building Solutions sectors."
Safety Intern (College 25-26 Season),28132,"Atlanta, Monroe, Frederick, Austin, Dallas, Boydton, Leesburg, Manassas, Richmond","GA, LA, MD, TX, VA",$20.00 - ,NA,https://careers.mcdean.com/jobs/28132?lang=en-us,medstar,Working towards an EHS related Bachelor of Science degree,False,2025-08-21 22:08:30,"The Construction Safety intern will be exposed to a wide variety of construction and electrical safety management system aspects, to include: assistance with the Construction Project Safety, Health (S&H;) assistance with implementing M.C. Dean’s site-specific Accident Prevention Plan, performing audit and inspections, and collaborating with Project Management, Safety Management, and Field Management in the implementation and leadership of the Operational Risk Management (ORM) process."
Dean|Fluor Critical Facilities Technician (General Maintenance Technician),14370,Tysons,Virginia,NA,NA,https://careers.mcdean.com/jobs/14370?lang=en-us,medstar,High School diploma or GED,False,2025-08-21 22:08:38,"Dean | Fluor is looking for a Critical Facilities Technician l (CFT -GMT) to undertake the responsibility to preserve the condition and functionality of a 24/7/365 critical government facility. Responsibilities include performing highly diversified duties to troubleshoot, repair, install and maintain facility equipment. The CFT typically performs work in one or more of the maintenance trades: HVAC, carpentry, plumbing, painting, and low voltage electrical, also working on our fuel systems. Must be available 24/7/365 with exception for personal time off that will be covered by delegate and expected to work in confined spaces, at elevations, on ladders, and lift equipment over six feet above the ground."
"M&A and Corporate Real Estate Analyst - Tysons, VA",28082,Tysons,Virginia,NA,NA,https://careers.mcdean.com/jobs/28082?lang=en-us,medstar,"Bachelor's or Master's degree in business, finance or engineering",False,2025-08-21 22:08:47,"The M&A and Corporate Real Estate Analyst provides support for all aspects of M.C. Dean's M&A, corporate real estate, and investment activities, including managing the deal pipeline, evaluation of potential transactions, performing due diligence, assisting post-acquisition integration activities, and supporting corporate real estate development projects. They are looking for candidates with 0+ years work experience in an investment banking, real estate investment or development, financial analysis, or a corporate development role with strong analytical, project management, and organizational skills with strong written and verbal communication skills required."
Senior Systems Engineer - Enterprise IT Infrastructure,14629,Tysons,Virginia,NA,NA,https://careers.mcdean.com/jobs/14629?lang=en-us,medstar,"Bachelor’s degree in computer science, Information Technology, or a Related Engineering Discipline",False,2025-08-21 22:08:55,"M.C. Dean relies on its IT infrastructure and applications to support critical business functions and drive value to the customers. The successful candidate will join a dynamic multidiscipline team responsible for design, implementation, integration, and support of the enterprise IT infrastructure, which includes secure cloud-hosted and on-premises environments. Responsibilities will include development of detailed technical and performance specifications, researching available technology options, producing detailed system design, system implementation, and managing lifecycle activities of the solution."
Operations Manager,14413,Tysons,Virginia,NA,NA,https://careers.mcdean.com/jobs/14413?lang=en-us,medstar,Engineering/Construction/Business degree,False,2025-08-21 22:09:03,"This Operations Manager position reports to the Program Manager. Must be able to support the management of medium to large complex construction/facility maintenance projects, within the Operations & Maintenance Function. Manage of structural, mechanical, electrical, architectural and civil construction/facility projects. Manage requirements for construction/maintenance projects in operating facilities also including Task Orders. Planning and scheduling contractor work in an operating facility also including Task Orders. Develop construction/facility maintenance scopes of work. Manage quality requirements for construction/facility maintenance projects. Manage construction/facility maintenance costs and budgets for Task Orders."
Engineer 2,14365,Tysons,Virginia,NA,NA,https://careers.mcdean.com/jobs/14365?lang=en-us,medstar,Bachelor of Science in an Engineering discipline,False,2025-08-21 22:09:12,"In this role, as part of a multidisciplinary engineering and construction team, you will develop and integrate engineering deliverables for complex and challenging electrical construction projects in the mission critical, healthcare, industrial, transportation, pharmaceutical, federal, and fortune 500 sectors. Work products include detailed design drawings, specifications, studies, product selections, installation sequence plans, and commissioning testing scripts, as well as the life cycle execution of the systems associated. This is a position for an experienced engineer, and general use and application of concepts, practices, and techniques is expected."
"Superintendent 2 (Telecommunications) - Tysons, VA",14611,Tysons,Virginia,NA,NA,https://careers.mcdean.com/jobs/14611?lang=en-us,medstar,"2-year technical degree (i.e. Engineering Technology, Construction Management) and 10+ years of Installation experience in IT, Cable, Electrical, RF and/or Telecommunications (Cellular Technologies) fields. OR 12+ years of Installation experience in IT, Cable, Electrical, RF and/or Telecommunications fields with a high school diploma",False,2025-08-21 22:09:37,"The position of Superintendent 2 (Telecommunications) demonstrates competency in job planning and management, with a strong ability to meet deadlines and execute work safely. The Superintendent 2 (Telecommunications) is responsible for all aspects of construction: safety, quality, schedule, and client satisfaction. This is a hands-on position, requiring a focus on results, and a willingness to solve problems that arise in the field. Responsibilities include overseeing entire wireless installation beginning at site survey through close-out package to customer. Role also includes managing team of installation contractors, team building, positive attitudes, goal setting."
Electronic Security Technical Specialist 2 (Tech Specialist 2),27765,Tysons,Virginia,NA,NA,https://careers.mcdean.com/jobs/27765?lang=en-us,medstar,"High School Diploma/GED with 8+ years of experience with installation, troubleshooting and/or testing of electronic security systems or Associates with 6+ years of experience",False,2025-08-21 22:09:46,"The job entails analyzing system performance, providing support to the system administration and engineering team, communicating with customers, training system users and other support personnel, troubleshooting system performance issues, and organizing and preparing detailed service records and analysis documentation. The candidate must have the ability to understand SOP and SOW documentation, conduct research and development on existing and future systems, and answer support calls to help field personnel with installation issues."
Dean|Fluor Critical Facilities Specialist (Mech) Vienna VA,14374,"Vienna, Tysons",Virginia,NA,NA,https://careers.mcdean.com/jobs/14374?lang=en-us,medstar,A minimum high school diploma or GED,False,2025-08-21 22:09:53,"Dean Fluor is looking for a Critical Facilities Specialist (CFS) Mechanical to join our operations team in the operations and maintenance of a mission critical government data center. The CFS Mechanical is responsible for ensuring that all mechanical, HVAC, fire/life safety equipment and generators including the diesel fuel tanks, pumping and plumbing within the data center is operating at peak efficiency. This involves continuous monitoring of mechanical equipment using advanced automated control systems, planned preventative maintenance of equipment, and emergency response to emergent issues."
Telecommunications Engineer Leader 1,27923,Tysons,Virginia,NA,NA,https://careers.mcdean.com/jobs/27923?lang=en-us,medstar,A Bachelor’s in Engineering with a minimum of 7+ years of experience or Master’s Degree in Engineering with 5+ years of experience,False,2025-08-21 22:10:02,"The Mission Critical Telecommunications Engineer Leader 1 (EL1) is responsible for leading the design, coordination, and execution of complex telecommunications and infrastructure engineering solutions for high-density, Artificial Intelligence (AI) driven data centers. This role combines deep technical expertise with leadership and mentoring capabilities to ensure the delivery of world-class, resilient, and scalable systems that support high density AI facilities and mission-critical operations. The Engineering Leader will guide cross-functional engineering teams, ensure adherence to best practices, and drive innovation in structured cabling, active low voltage systems, and integrated infrastructure."
Control Engineer 4,14787,Tysons,Virginia,NA,NA,https://careers.mcdean.com/jobs/14787?lang=en-us,medstar,"Master's degree in electrical engineering, automation engineering, or a related field 5 - 7 years of experience",False,2025-08-21 22:10:12,"Control Engineers are responsible for designing, developing, installing, and maintaining equipment used to monitor and control systems, machinery, and processes. Control Engineers work in various applications including industrial controls, cybersecurity, building automation, water / wastewater, power controls and protection, energy management, and transportation systems.
They're technical experts in areas such as advanced process control, instrumentation, distributed control systems, PLCs, and SCADA systems. Control engineers use these skills to design and implement solutions to solve our customer's most complex needs."
Electronics Technician 2 - 100% Travel,27079,Tysons,Virginia,$30.00,NA,https://careers.mcdean.com/jobs/27079?lang=en-us,medstar,HS diploma or GED or Military Electronics Training (minimum 720 classroom hours) or Graduation from an accredited Electronics Technician program or Graduation from an Electrical Apprenticeship program,False,2025-08-21 22:10:22,"We're seeking people driven to excellence and inspired to have a meaningful impact powering, automating, integrating, and securing the world’s most critical infrastructure and facilities. As an employee at M.C. Dean, you will join forces with more than 5,800 professionals who engineer and deploy automated, secure and resilient power and technology systems. We are seeking an Electronics Tech 2 to join our Security and Electronic Systems (SES) business Unit."
Telecommunications Engineer 3,14588,Tysons,Virginia,NA,NA,https://careers.mcdean.com/jobs/14588?lang=en-us,medstar,Bachelor's Degree,False,2025-08-21 22:10:30,"The Telecommunications Engineer 3 position involves the design, coordination, and specifying of telecommunication distribution systems and infrastructure for medium to large projects. The engineer coordinates and designs pathways and cabling for inside and outside plant infrastructure, produces floor plans that illustrate communication outlet locations, enlarged plans of telecommunication spaces, and provides labeling plans and run lists to support the design. The designer creates project specifications for construction, materials, and testing of components. The engineer will oversee the project throughout the entire project lifecycle, assisting with construction issues, scheduling and budget."
Deputy Project Leader (Telecommunications),14597,Tysons,Virginia,"$500,000 to $10",NA,https://careers.mcdean.com/jobs/14597?lang=en-us,medstar,"Bachelor’s Degree, with a preference to Engineering, Construction Management or similar",False,2025-08-21 22:10:48,"The Deputy Project Leader (Telecommunications) is a training position that consists of learning how to supervise and direct the employees on a particular project, prepare strategic plans and budgets, develop a comprehensive project plan, and analyze statistical data. In addition, the role involves running day-to-day operations of a project or sub-section of a project, identifying, pricing, tracking and managing change orders, and planning and monitoring cash flow against cash expenses. The Deputy Project Leader must also maintain as-builts as work is completed, document project issues/conditions, and plan and execute project completion and punch list. A familiarity with standard deliverables and work processes on construction and integration projects is essential, as is the ability to effectively plan and organize one's own activities or the activities of others."
Tech Specialist 3,27160,Tysons,Virginia,NA,NA,https://careers.mcdean.com/jobs/27160?lang=en-us,medstar,High school diploma or GED,False,2025-08-21 22:10:57,"The Technology Specialist 3 independently develops and implements configurations, automation tools, and scripts for IT and OT systems. This role is responsible for managing a wide range of system components across multiple interconnected systems, ensuring proper functionality, performance, and security. The Technology Specialist 3 provides technical leadership and supervises others as required."
